<?xml version="1.0" encoding="UTF-8"?>

<Kalender xmlns:xsi="http://www.w3.org/2001/XMLSchema-instance" xsi:noNamespaceSchemaLocation="kalender.xsd">
    <PersonenKalender>
        <Name>Person1</Name>
        <Termine>
            <Termin>
                <Name>Zahnarzt</Name>
                <Start>2024-05-30T08:00:00</Start>
                <Ende>2024-05-30T09:00:00</Ende>
            </Termin>
            <Termin>
                <Name>Vorlesung Mathe</Name>
                <Start>2024-05-30T10:00:00</Start>
                <Ende>2024-05-30T12:00:00</Ende>
            </Termin>
            <Termin>
                <Name>Klettern</Name>
                <Start>2024-05-30T17:00:00</Start>
                <Ende>2024-05-30T19:00:00</Ende>
            </Termin>
        </Termine>
        <Besitzer>Eva</Besitzer>
    </PersonenKalender>
</Kalender>