<?xml version="1.0" encoding="UTF-8"?>

<Kalender xmlns:xsi="http://www.w3.org/2001/XMLSchema-instance" xsi:noNamespaceSchemaLocation="kalender.xsd">
    <GruppenKalender>
        <Name>Gruppe1</Name>
        <Termine>
            <Termin>
                <Name>Praktikum KI</Name>
                <Start>2024-05-30T08:00:00</Start>
                <Ende>2024-05-30T12:00:00</Ende>
            </Termin>
            <Termin>
                <Name>Praktikum KI</Name>
                <Start>2024-06-06T08:00:00</Start>
                <Ende>2024-06-06T12:00:00</Ende>
            </Termin>
            <Termin>
                <Name>Praktikum KI</Name>
                <Start>2024-06-13T08:00:00</Start>
                <Ende>2024-06-13T12:00:00</Ende>
            </Termin>
        </Termine>
        <Mitglieder>
            <Mitglied>Martina</Mitglied>
            <Mitglied>Ella</Mitglied>
        </Mitglieder>
    </GruppenKalender>
</Kalender>